[
  {
    "schema_version": "1.0.0",
    "id": "openai:rakuten",
    "source": "openai_blog",
    "source_url": "https://openai.com/index/rakuten",
    "title": "Rakuten fixes issues twice as fast with Codex",
    "raw_summary": "",
    "raw_content": "Rakuten uses Codex, the coding agent from OpenAI, to ship software faster and safer, reducing MTTR 50%, automating CI/CD reviews, and delivering full-stack builds in weeks.",
    "pipeline_state": "raw_scraped",
    "preprocessing": {
      "cleaned_text": "Rakuten uses Codex, the coding agent from OpenAI, to ship software faster and safer, reducing MTTR 50%, automating CI/CD reviews, and delivering full-stack builds in weeks.",
      "preview_text": "Rakuten uses Codex, the coding agent from OpenAI, to ship software faster and safer, reducing MTTR 50%, automating CI/CD reviews, and delivering full-stack builds in weeks.",
      "quality_notes": [
        "rss_scraped",
        "metadata_cleaned"
      ],
      "enrichment_used": false
    },
    "ranking": {
      "source_rank_score": 1.0,
      "trending_score": 1.0
    },
    "metadata": {
      "published_date": "Wed, 11 Mar 2026 13:00:00 GMT",
      "rank": 1,
      "keywords": [],
      "freshness_basis": "news_listing_order"
    },
    "provenance": {
      "collector": "openai_news_scraper",
      "collector_version": "0.2.0",
      "dedupe_key": "openai:rakuten"
    },
    "fetched_at": "2026-03-14T03:52:07.114862+00:00"
  },
  {
    "schema_version": "1.0.0",
    "id": "openai:designing-agents-to-resist-prompt-injection",
    "source": "openai_blog",
    "source_url": "https://openai.com/index/designing-agents-to-resist-prompt-injection",
    "title": "Designing AI agents to resist prompt injection",
    "raw_summary": "",
    "raw_content": "How ChatGPT defends against prompt injection and social engineering by constraining risky actions and protecting sensitive data in agent workflows.",
    "pipeline_state": "raw_scraped",
    "preprocessing": {
      "cleaned_text": "How ChatGPT defends against prompt injection and social engineering by constraining risky actions and protecting sensitive data in agent workflows.",
      "preview_text": "How ChatGPT defends against prompt injection and social engineering by constraining risky actions and protecting sensitive data in agent workflows.",
      "quality_notes": [
        "rss_scraped",
        "metadata_cleaned"
      ],
      "enrichment_used": false
    },
    "ranking": {
      "source_rank_score": 0.8,
      "trending_score": 0.8
    },
    "metadata": {
      "published_date": "Wed, 11 Mar 2026 11:30:00 GMT",
      "rank": 2,
      "keywords": [],
      "freshness_basis": "news_listing_order"
    },
    "provenance": {
      "collector": "openai_news_scraper",
      "collector_version": "0.2.0",
      "dedupe_key": "openai:designing-agents-to-resist-prompt-injection"
    },
    "fetched_at": "2026-03-14T03:52:07.115983+00:00"
  },
  {
    "schema_version": "1.0.0",
    "id": "openai:wayfair",
    "source": "openai_blog",
    "source_url": "https://openai.com/index/wayfair",
    "title": "Wayfair boosts catalog accuracy and support speed with OpenAI",
    "raw_summary": "",
    "raw_content": "Wayfair uses OpenAI models to improve ecommerce support and product catalog accuracy, automating ticket triage and enhancing millions of product attributes at scale.",
    "pipeline_state": "raw_scraped",
    "preprocessing": {
      "cleaned_text": "Wayfair uses OpenAI models to improve ecommerce support and product catalog accuracy, automating ticket triage and enhancing millions of product attributes at scale.",
      "preview_text": "Wayfair uses OpenAI models to improve ecommerce support and product catalog accuracy, automating ticket triage and enhancing millions of product attributes at scale.",
      "quality_notes": [
        "rss_scraped",
        "metadata_cleaned"
      ],
      "enrichment_used": false
    },
    "ranking": {
      "source_rank_score": 0.6,
      "trending_score": 0.6
    },
    "metadata": {
      "published_date": "Wed, 11 Mar 2026 11:00:00 GMT",
      "rank": 3,
      "keywords": [],
      "freshness_basis": "news_listing_order"
    },
    "provenance": {
      "collector": "openai_news_scraper",
      "collector_version": "0.2.0",
      "dedupe_key": "openai:wayfair"
    },
    "fetched_at": "2026-03-14T03:52:07.116021+00:00"
  },
  {
    "schema_version": "1.0.0",
    "id": "openai:equip-responses-api-computer-environment",
    "source": "openai_blog",
    "source_url": "https://openai.com/index/equip-responses-api-computer-environment",
    "title": "From model to agent: Equipping the Responses API with a computer environment",
    "raw_summary": "",
    "raw_content": "How OpenAI built an agent runtime using the Responses API, shell tool, and hosted containers to run secure, scalable agents with files, tools, and state.",
    "pipeline_state": "raw_scraped",
    "preprocessing": {
      "cleaned_text": "How OpenAI built an agent runtime using the Responses API, shell tool, and hosted containers to run secure, scalable agents with files, tools, and state.",
      "preview_text": "How OpenAI built an agent runtime using the Responses API, shell tool, and hosted containers to run secure, scalable agents with files, tools, and state.",
      "quality_notes": [
        "rss_scraped",
        "metadata_cleaned"
      ],
      "enrichment_used": false
    },
    "ranking": {
      "source_rank_score": 0.4,
      "trending_score": 0.4
    },
    "metadata": {
      "published_date": "Wed, 11 Mar 2026 11:00:00 GMT",
      "rank": 4,
      "keywords": [],
      "freshness_basis": "news_listing_order"
    },
    "provenance": {
      "collector": "openai_news_scraper",
      "collector_version": "0.2.0",
      "dedupe_key": "openai:equip-responses-api-computer-environment"
    },
    "fetched_at": "2026-03-14T03:52:07.116054+00:00"
  },
  {
    "schema_version": "1.0.0",
    "id": "openai:instruction-hierarchy-challenge",
    "source": "openai_blog",
    "source_url": "https://openai.com/index/instruction-hierarchy-challenge",
    "title": "Improving instruction hierarchy in frontier LLMs",
    "raw_summary": "",
    "raw_content": "IH-Challenge trains models to prioritize trusted instructions, improving instruction hierarchy, safety steerability, and resistance to prompt injection attacks.",
    "pipeline_state": "raw_scraped",
    "preprocessing": {
      "cleaned_text": "IH-Challenge trains models to prioritize trusted instructions, improving instruction hierarchy, safety steerability, and resistance to prompt injection attacks.",
      "preview_text": "IH-Challenge trains models to prioritize trusted instructions, improving instruction hierarchy, safety steerability, and resistance to prompt injection attacks.",
      "quality_notes": [
        "rss_scraped",
        "metadata_cleaned"
      ],
      "enrichment_used": false
    },
    "ranking": {
      "source_rank_score": 0.2,
      "trending_score": 0.2
    },
    "metadata": {
      "published_date": "Tue, 10 Mar 2026 11:00:00 GMT",
      "rank": 5,
      "keywords": [],
      "freshness_basis": "news_listing_order"
    },
    "provenance": {
      "collector": "openai_news_scraper",
      "collector_version": "0.2.0",
      "dedupe_key": "openai:instruction-hierarchy-challenge"
    },
    "fetched_at": "2026-03-14T03:52:07.116089+00:00"
  }
]