[
  {
    "schema_version": "1.0.0",
    "id": "huggingface:2603.12255",
    "source": "huggingface",
    "source_url": "https://huggingface.co/papers/2603.12255",
    "title": "Spatial-TTT: Streaming Visual-based Spatial Intelligence with Test-Time Training",
    "raw_summary": "Humans perceive and understand real-world spaces through a stream of visual observations. Therefore, the ability to streamingly maintain and update spatial evidence from potentially unbounded video streams is essential for spatial intelligence. The core challenge is not simply longer context windows but how spatial information is selected, organized, and retained over time. In this paper, we propose Spatial-TTT towards streaming visual-based spatial intelligence with test-time training (TTT), which adapts a subset of parameters (fast weights) to capture and organize spatial evidence over long-horizon scene videos. Specifically, we design a hybrid architecture and adopt large-chunk updates parallel with sliding-window attention for efficient spatial video processing. To further promote spatial awareness, we introduce a spatial-predictive mechanism applied to TTT layers with 3D spatiotemporal convolution, which encourages the model to capture geometric correspondence and temporal continuity across frames. Beyond architecture design, we construct a dataset with dense 3D spatial descriptions, which guides the model to update its fast weights to memorize and organize global 3D spatial signals in a structured manner. Extensive experiments demonstrate that Spatial-TTT improves long-horizon spatial understanding and achieves state-of-the-art performance on video spatial benchmarks. Project page: https://liuff19.github.io/Spatial-TTT.",
    "raw_content": "Humans perceive and understand real-world spaces through a stream of visual observations. Therefore, the ability to streamingly maintain and update spatial evidence from potentially unbounded video streams is essential for spatial intelligence. The core challenge is not simply longer context windows but how spatial information is selected, organized, and retained over time. In this paper, we propose Spatial-TTT towards streaming visual-based spatial intelligence with test-time training (TTT), which adapts a subset of parameters (fast weights) to capture and organize spatial evidence over long-horizon scene videos. Specifically, we design a hybrid architecture and adopt large-chunk updates parallel with sliding-window attention for efficient spatial video processing. To further promote spatial awareness, we introduce a spatial-predictive mechanism applied to TTT layers with 3D spatiotemporal convolution, which encourages the model to capture geometric correspondence and temporal continuity across frames. Beyond architecture design, we construct a dataset with dense 3D spatial descriptions, which guides the model to update its fast weights to memorize and organize global 3D spatial signals in a structured manner. Extensive experiments demonstrate that Spatial-TTT improves long-horizon spatial understanding and achieves state-of-the-art performance on video spatial benchmarks. Project page: https://liuff19.github.io/Spatial-TTT. Humans perceive and understand real-world spaces through a stream of visual observations. Therefore, the ability to streamingly maintain and update spatial evidence from potentially unbounded video streams is essential for spatial intelligence. The core challenge is not simply longer context windows but how spatial information is selected, organized, and retained over time. In this paper, we propose Spatial-TTT towards streaming visual-based spatial intelligence with test-time training (TTT), which adapts a subset of parameters ( fast weights ) to capture and organize spatial evidence over long-horizon scene videos . Specifically, we design a hybrid architecture and adopt large-chunk updates parallel with sliding-window attention for efficient spatial video processing. To further promote spatial awareness, we introduce a spatial-predictive mechanism applied to TTT layers with 3D spatiotemporal convolution , which encourages the model to capture geometric correspondence and temporal continuity across frames. Beyond architecture design, we construct a dataset with dense 3D spatial descriptions, which guides the model to update its fast weights to memorize and organize global 3D spatial signals in a structured manner. Extensive experiments demonstrate that Spatial-TTT improves long-horizon spatial understanding and achieves state-of-the-art performance on video spatial benchmarks . Project page: https://liuff19.github.io/Spatial-TTT.",
    "pipeline_state": "raw_scraped",
    "preprocessing": {
      "cleaned_text": "Humans perceive and understand real-world spaces through a stream of visual observations. Therefore, the ability to streamingly maintain and update spatial evidence from potentially unbounded video streams is essential for spatial intelligence. The core challenge is not simply longer context windows but how spatial information is selected, organized, and retained over time. In this paper, we propose Spatial-TTT towards streaming visual-based spatial intelligence with test-time training (TTT), which adapts a subset of parameters (fast weights) to capture and organize spatial evidence over long-horizon scene videos. Specifically, we design a hybrid architecture and adopt large-chunk updates parallel with sliding-window attention for efficient spatial video processing. To further promote spatial awareness, we introduce a spatial-predictive mechanism applied to TTT layers with 3D spatiotemporal convolution, which encourages the model to capture geometric correspondence and temporal continuity across frames. Beyond architecture design, we construct a dataset with dense 3D spatial descriptions, which guides the model to update its fast weights to memorize and organize global 3D spatial signals in a structured manner. Extensive experiments demonstrate that Spatial-TTT improves long-horizon spatial understanding and achieves state-of-the-art performance on video spatial benchmarks. Project page: https://liuff19.github.io/Spatial-TTT.",
      "quality_notes": [
        "paper_metadata_extracted",
        "keyword_enrichment_pending"
      ],
      "enrichment_used": false
    },
    "ranking": {
      "source_rank_score": 1.0,
      "trending_score": 1.0
    },
    "metadata": {
      "paper_id": "2603.12255",
      "arxiv_id": "2603.12255",
      "authors": [
        "Liu, Fangfu",
        "Wu, Diankun",
        "Chi, Jiawei",
        "Cai, Yimo",
        "Hung, Yi-Hsin",
        "Yu, Xumin",
        "Li, Hao",
        "Hu, Han",
        "Rao, Yongming",
        "Duan, Yueqi"
      ],
      "published_date": "2026/03/12",
      "hf_url": "https://huggingface.co/papers/2603.12255",
      "arxiv_abs_url": "https://arxiv.org/abs/2603.12255",
      "arxiv_pdf_url": "https://arxiv.org/pdf/2603.12255.pdf",
      "pdf_path": "",
      "pdf_downloaded": false,
      "rank": 1,
      "freshness_basis": "huggingface_papers_rank_freshness"
    },
    "provenance": {
      "collector": "huggingface_papers_scraper",
      "collector_version": "0.1.0",
      "dedupe_key": "huggingface:2603.12255"
    },
    "fetched_at": "2026-03-14T04:00:16.456585+00:00"
  }
]